{
  "$schema": "https://json-schema.org/draft/2020-12/schema",
  "$id": "https://local/research_harness/domain_taxonomy.schema.json",
  "title": "DomainTaxonomy",
  "description": "ADR 0009 (B1): the operator-curated, OFFLINE domain graph + pairwise conceptual distances that B1's far-framing successor policy selects D_i from. The construction loop never authors or edits this; it is pinned per-thread with a provenance hash. Its coverage is, by design, the operator's concept coverage — an explicit, auditable, un-gameable bound.",
  "type": "object",
  "required": ["version", "domains", "distances"],
  "properties": {
    "version": { "type": "string", "minLength": 1 },
    "domains": {
      "type": "array",
      "minItems": 2,
      "description": "The native + candidate domains a problem can be mapped into.",
      "items": {
        "type": "object",
        "required": ["id", "label"],
        "properties": {
          "id": { "type": "string", "pattern": "^[a-z0-9_]+$" },
          "label": { "type": "string", "minLength": 2 },
          "tags": { "type": "array", "items": { "type": "string" } }
        },
        "additionalProperties": false
      }
    },
    "distances": {
      "type": "object",
      "description": "Symmetric conceptual distances in [0,1], keyed by sorted 'a|b' domain-id pairs. An unlisted pair is treated as unknown (not selectable as 'far'). 0 = same manifold; 1 = maximally distant.",
      "additionalProperties": { "type": "number", "minimum": 0, "maximum": 1 }
    },
    "notes": { "type": "string" },
    "source_provenance": {
      "type": "string",
      "description": "Harness-stamped at pin time (taxonomy_sha256:<hash>) so a later construction cannot swap the table it is judged against."
    }
  },
  "additionalProperties": false
}
