{
  "version": "1",
  "notes": "ADR 0009 (B1): operator-curated, OFFLINE domain graph for far-framing successor selection. Edit this file to extend reach — it is the cheapest external-manifold addition. Distances are symmetric conceptual distances in [0,1]; an unlisted pair is unknown (not selectable as far). This is a starter table; the operator should grow it to cover domains a problem could be bridged into.",
  "domains": [
    { "id": "agent_harness", "label": "Agent / research harness engineering", "tags": ["orchestration", "optimization", "software"] },
    { "id": "quant_finance", "label": "Quantitative finance", "tags": ["optimization", "signal", "risk"] },
    { "id": "control_theory", "label": "Control theory", "tags": ["feedback", "stability", "dynamics"] },
    { "id": "statistical_mechanics", "label": "Statistical mechanics", "tags": ["ensembles", "phase-transition", "entropy"] },
    { "id": "ecology", "label": "Ecology / population dynamics", "tags": ["niche", "competition", "carrying-capacity"] },
    { "id": "linguistics", "label": "Structural linguistics", "tags": ["grammar", "compositionality", "ambiguity"] },
    { "id": "immunology", "label": "Immunology", "tags": ["selection", "diversity", "memory"] }
  ],
  "distances": {
    "agent_harness|quant_finance": 0.35,
    "agent_harness|control_theory": 0.55,
    "agent_harness|statistical_mechanics": 0.66,
    "agent_harness|linguistics": 0.72,
    "agent_harness|ecology": 0.78,
    "agent_harness|immunology": 0.84,
    "control_theory|quant_finance": 0.4,
    "control_theory|statistical_mechanics": 0.5,
    "ecology|immunology": 0.45,
    "ecology|statistical_mechanics": 0.6,
    "linguistics|immunology": 0.8,
    "linguistics|statistical_mechanics": 0.75,
    "quant_finance|ecology": 0.7,
    "quant_finance|immunology": 0.85
  }
}
